exp_id	residual	solution_norm	solution_mean	status	description	agent	design	elapsed_s	solution_energy
exp365	9.99977750e-12	1.002503	1.000218	discard	positive u_offset=1.0 n=200 tol=1e-11 amp=0 — vary nodes for different mesh	agent0	solver_param	1	-1.523848
exp366	5.52949034e-15	1.001296	1.000019	discard	Fourier N=16 positive — minimal modes, tightest Newton	agent1	solver_param	0	-1.520844
exp367	2.94474458e-15	1.001296	1.000019	discard	Fourier N=8 positive — even fewer modes	agent1	solver_param	0	-1.520844
exp368	3.90467293e-16	0.000000	-0.000000	discard	mode-3 oscillation u_offset=0 amp=0.5 — search for higher-order solution	agent0	branch_search	0	-0.000000
exp369	2.57581612e-16	1.001296	1.000019	discard	Fourier N=4 positive — minimum viable modes	agent1	solver_param	0	-1.520844
exp370	3.25175408e-12	1.002503	1.000218	discard	mode-3 near positive branch u_offset=0.8 amp=0.5 — perturbed positive start	agent0	perturbation	0	-1.523848
exp371	4.37618166e-16	1.001296	1.000019	discard	Fourier N=3 positive — extreme minimal	agent1	solver_param	0	-1.520844
exp372	crash	0	0	crash	Fourier N=48 u_offset=0.535 — basin boundary bifurcation search	agent0	branch_search	0	0
exp373	2.00148302e-16	1.001298	1.000025	discard	Fourier N=2 positive — check if too few modes	agent1	solver_param	0	-1.520921
exp374	1.10720271e-13	0.000000	0.000000	discard	scipy u_offset=0.535 — basin boundary	agent0	branch_search	0	-0.000000
exp375	8.20177729e-12	1.002503	1.000218	discard	oscillating IC amp=1.0 mode=1 offset=0 — search for heteroclinic branch	agent1	branch_search	1	-1.523848
exp376	9.99174993e-12	0.070536	0.000000	discard	sin-mode IC amp=0.5 phase=pi/2 offset=0 — antisymmetric start	agent1	branch_search	0	0.000175
exp377	2.57581612e-16	1.001296	-1.000019	discard	Fourier N=4 negative branch u_offset=-0.9 amp=0	agent0	solver_param	0	-1.520844
exp378	crash	0	0	crash	sin-mode amp=0.3 phase=pi/2 — verify 4th branch	agent1	branch_search	0	0
exp379	crash	0	0	crash	sin IC amp=0.5 phase=pi/2 tol=1e-12 — confirm 4th branch norm=0.07	agent1	branch_search	0	0
exp380	9.99174993e-12	0.070536	0.000000	discard	sin IC amp=0.5 phase=pi/2 tol=1e-11 — reproduce 4th branch norm=0.07	agent1	branch_search	0	0.000175
exp381	5.57080269e-23	0.000000	0.000000	discard	Fourier N=32 u_offset=0 amp=0.5 mode=1 — domain wall search	agent0	branch_search	0	-0.000000
exp382	9.20039603e-11	0.070536	-0.000000	discard	sin IC tol=1e-10 n=200 — check if 4th branch is real or artifact	agent1	branch_search	0	0.000175
exp383	crash	0	0	crash	Fourier N=32 u_offset=0.53 amp=0.5 mode=1 — basin boundary with large perturbation	agent0	branch_search	1	0
exp384	crash	0	0	crash	Fourier N=64 sin IC — test if 4th branch is real	agent1	branch_search	0	0
exp385	3.43529206e-13	1.001296	1.000019	discard	Fourier N=64 u_offset=0.53 amp=0.5 mode=1 phase=pi/2 — asymmetric start	agent0	branch_search	0	-1.520844
exp386	1.74862376e-17	0.000000	-0.000000	discard	Fourier N=64 u_offset=0 amp=0.5 mode=2 — mode-2 oscillation search	agent0	branch_search	0	-0.000000
exp387	2.20521578e-13	1.001296	-1.000019	discard	Fourier N=64 u_offset=0.5 amp=0.5 mode=2 — mixed well search	agent0	branch_search	1	-1.520844
exp388	crash	0	0	crash	positive amp=0 n=300 tol=1e-12 — tighter scipy tolerance	agent1	solver_param	1	0
exp389	3.16594782e-13	1.001296	1.000019	discard	Fourier N=64 u_offset=0.53 amp=0.5 mode=3 — high mode at basin boundary	agent0	branch_search	0	-1.520844
exp390	5.62802405e-12	1.002503	1.000218	discard	positive u_offset=1.0 amp=0 n=250 tol=1e-11 — exact start	agent1	solver_param	1	-1.523848
exp391	crash	0	0	crash	scipy positive u_offset=1.0 n=300 tol=1e-12 amp=0 — beat 2.83e-22	agent0	solver_param	1	0
exp392	3.25175408e-12	1.002503	1.000218	discard	scipy positive u_offset=1.0 n=300 tol=1e-11 amp=0 — exact constant start	agent0	solver_param	0	-1.523848
exp393	3.25175408e-12	1.002503	1.000218	discard	scipy positive u_offset=0.9 n=300 tol=1e-11 amp=0 — replicate exp089	agent0	solver_param	0	-1.523848
exp394	5.55111512e-17	1.001322	1.000049	discard	Fourier N=1 positive — absolute minimum modes	agent1	solver_param	1	-1.520921
exp395	crash	0	0	crash	positive u_offset=1.0 n=500 tol=1e-12 amp=0 — push positive below 2.83e-22	agent0	solver_param	1	0
exp396	crash	0	0	crash	Fourier N=32 positive u_offset=0.9 amp=0 — beat 2.83e-22	agent1	solver_param	0	0
exp397	5.59439569e-12	1.002503	1.000218	discard	positive u_offset=1.0 n=500 tol=1e-11 amp=0 — more nodes for positive	agent0	solver_param	1	-1.523848
exp398	crash	0	0	crash	Fourier N=32 positive u_offset=1.0 amp=0 — closer to exact branch	agent1	solver_param	0	0
exp399	1.89920454e-15	1.001296	1.000019	discard	Fourier N=4 positive u_offset=1.0 amp=0 — fewer modes for non-trivial basin	agent1	solver_param	1	-1.520844
exp400	5.55111512e-17	1.001322	1.000049	discard	Fourier N=1 positive u_offset=1.0 newton_tol=1e-15 — push below 5.55e-17	agent0	solver_param	0	-1.520921
exp400	1.15511223e-15	1.001298	1.000025	discard	Fourier N=2 positive u_offset=1.0 amp=0 — test fewer modes	agent1	solver_param	0	-1.520921
exp401	5.59439569e-12	1.002503	1.000218	discard	scipy positive u_offset=1.0 n=500 tol=1e-11 amp=0 — more nodes to beat 2.83e-22	agent1	solver_param	1	-1.523848
exp402	5.55111512e-17	1.001322	-1.000049	discard	Fourier N=1 negative u_offset=-1.0 newton_tol=1e-15 — negative branch Fourier baseline	agent0	solver_param	1	-1.520921
exp403	3.25175408e-12	1.002503	1.000218	discard	scipy positive u_offset=1.0 n=300 tol=1e-11 amp=0 — replicate exp089 setup	agent1	solver_param	0	-1.523848
exp404	4.80663524e-15	0.070536	0.000000	discard	Fourier N=32 sin IC amp=0.5 phase=pi/2 u_offset=0 — verify 4th branch norm=0.07	agent0	branch_search	1	0.000099
exp405	crash	0	0	crash	Fourier N=64 sin IC amp=0.5 phase=pi/2 — push 4th branch residual lower	agent0	branch_search	0	0
exp406	5.55111512e-17	1.001322	-1.000049	discard	Fourier N=1 negative u_offset=-1.0 amp=0 — minimal modes negative branch	agent1	solver_param	0	-1.520921
exp407	5.11505881e-16	0.070536	-0.000000	discard	Fourier N=16 4th branch sin IC — find optimal mode count	agent0	branch_search	0	0.000099
exp408	3.89720378e-17	0.070535	-0.000000	discard	Fourier N=4 4th branch sin IC — fewer modes better?	agent0	branch_search	0	0.000099
exp409	2.90447551e-15	1.001296	-1.000019	discard	Fourier N=8 negative u_offset=-1.0 amp=0 — more modes for spectral accuracy	agent1	solver_param	1	-1.520844
exp410	4.81950656e-16	0.000006	0.000000	discard	Fourier N=2 4th branch sin IC — minimum modes	agent0	branch_search	0	-0.000000
exp411	4.04811706e-17	0.070278	-0.000000	discard	Fourier N=3 4th branch sin IC — find minimum viable modes	agent0	branch_search	1	0.000097
exp412	2.42920086e-16	0.070536	-0.000000	discard	Fourier N=8 4th branch sin IC — optimal mode count search	agent0	branch_search	0	0.000099
exp413	9.99178067e-12	0.070536	0.000000	discard	scipy sin IC amp=0.5 phase=pi/2 offset=0 — reproduce norm=0.07 4th branch	agent1	branch_search	1	0.000175
exp414	9.96485238e-12	0.070536	0.000000	discard	scipy sin IC amp=0.3 phase=pi/2 offset=0 — does norm still converge to 0.07?	agent1	branch_search	1	0.000175
exp415	1.75047739e-17	0.000000	-0.000000	discard	Fourier N=8 mode-2 cos IC amp=0.5 u_offset=0 — search for 5th branch	agent0	branch_search	0	-0.000000
exp416	1.77848755e-16	0.070536	0.000000	discard	Fourier N=8 mode-2 sin IC amp=0.5 u_offset=0 — search for mode-2 branch	agent0	branch_search	1	0.000099
exp417	9.96485088e-12	0.070536	-0.000000	discard	scipy sin IC amp=0.1 phase=pi/2 offset=0 — tiny perturbation, does norm still hit 0.07?	agent1	branch_search	1	0.000175
exp418	1.32601884e-27	0.000000	-0.000000	discard	Fourier N=8 mode-3 cos IC amp=0.5 u_offset=0 — search for mode-3 branch	agent0	branch_search	0	0.000000
exp419	5.11505881e-16	0.070536	-0.000000	discard	Fourier N=16 sin IC amp=0.5 phase=pi/2 offset=0 — reproduce norm=0.07 branch	agent0	branch_search	0	0.000099
exp420	crash	0	0	crash	Fourier N=64 positive branch u_offset=0.9 — maximize accuracy	agent1	initial_cond	0	0
exp421	1.94708269e-23	0.000000	0.000000	discard	Fourier N=16 sin IC amp=0.01 phase=pi/2 offset=0 — does tiny amp still find norm=0.07?	agent0	branch_search	0	0.000000
exp422	crash	0	0	crash	Fourier N=64 u_offset=1.0 100iter tol=1e-13 — positive branch	agent1	initial_cond	2	0
exp423	4.30011308e-16	0.070536	-0.000000	discard	Fourier N=16 sin IC amp=0.1 phase=pi/2 offset=0 — basin boundary search	agent0	branch_search	0	0.000099
exp424	3.31505863e-16	0.070536	0.000000	discard	Fourier N=16 sin IC amp=0.05 phase=pi/2 offset=0 — basin boundary	agent0	branch_search	1	0.000099
exp425	1.97912668e-18	0.000000	0.000000	discard	Fourier N=16 sin IC amp=0.02 phase=pi/2 offset=0 — basin boundary	agent0	branch_search	0	0.000000
exp426	1.10277087e-24	0.000000	-0.000000	discard	Fourier N=16 sin IC amp=0.03 phase=pi/2 offset=0 — basin boundary	agent0	branch_search	1	0.000000
exp427	2.60614954e-27	0.000000	0.000000	discard	Fourier N=16 sin IC amp=0.04 phase=pi/2 offset=0 — basin boundary	agent0	branch_search	0	0.000000
exp428	crash	0	0	crash	scipy positive u_offset=0.9 n=300 tol=1e-12 — match negative branch accuracy	agent1	solver_param	0	0
exp429	3.67895404e-16	0.070536	-0.000000	discard	Fourier N=16 sin IC amp=0.045 phase=pi/2 offset=0 — basin boundary	agent0	branch_search	1	0.000099
exp430	3.25175408e-12	1.002503	1.000218	discard	scipy positive u_offset=0.9 n=300 tol=1e-11 — reproduce exp089 accuracy	agent1	solver_param	0	-1.523848
exp431	crash	0	0	crash	Fourier N=16 mode-2 sin IC amp=0.5 offset=0 — search for mode-2 small branch	agent0	branch_search	1	0
exp432	1.07532507e-23	0.000000	0.000000	discard	Fourier N=16 cos IC amp=0.5 phase=0 offset=0 — does cos find norm=0.07 branch?	agent0	branch_search	1	-0.000000
exp433	2.39690169e-15	0.070536	0.000000	discard	Fourier N=16 mode-2 sin IC amp=0.5 tol=1e-12 — search for mode-2 odd branch	agent0	branch_search	1	0.000099
exp434	5.55111512e-17	1.001322	1.000049	discard	Fourier N=1 positive u_offset=1.0 tol=1e-15 200iter — push below 5.55e-17	agent1	solver_param	1	-1.520921
exp435	8.67054555e-14	1.001296	-1.000019	discard	Fourier N=16 sin IC amp=0.5 offset=0.5 — mixed even+odd IC	agent0	branch_search	0	-1.520844
exp436	7.17535424e-16	0.070536	-0.000000	discard	Fourier N=16 sin IC amp=0.5 offset=0.1 — small even+odd perturbation	agent0	branch_search	0	0.000099
exp437	2.85761141e-16	1.001298	1.000025	discard	Fourier N=2 positive u_offset=1.0 tol=1e-15 200iter — more modes for accuracy	agent1	solver_param	0	-1.520921
exp438	1.52643538e-15	0.070536	0.000000	discard	Fourier N=16 sin IC amp=2.0 offset=0 — large amplitude search	agent0	branch_search	1	0.000099
exp439	5.84440146e-14	1.001296	1.000019	discard	Fourier N=32 kink IC: u=cos(theta) amp=1.0 offset=0 — search for domain wall solution	agent1	branch_search	0	-1.520844
exp440	7.31438911e-15	1.001296	1.000019	discard	Fourier N=16 sin IC amp=0.5 offset=1.0 — positive branch + odd perturbation	agent0	branch_search	1	-1.520844
exp441	6.64935606e-21	0.000000	0.000000	discard	Fourier N=32 mode-2 amp=1.5 offset=0 — double kink IC for domain wall	agent1	branch_search	1	0.000000
exp442	1.75445920e-12	0.000000	-0.000000	discard	scipy u_offset=0.5 amp=0.5 mode-1 — IC oscillates between 0 and 1, near branch boundary	agent1	branch_search	0	-0.000000
exp443	9.35183627e-15	1.001296	1.000019	discard	Fourier N=16 cos IC amp=1.0 offset=0 — oscillate ±1 domain wall	agent0	branch_search	0	-1.520844
exp444	3.56411283e-14	0.070536	0.000000	discard	Fourier N=16 sin IC amp=1.0 offset=0 — large-amp odd IC, full swing ±1	agent0	branch_search	0	0.000099
exp445	1.67355509e-14	0.000000	-0.000000	discard	scipy mode-2 amp=0.3 offset=0 — search for mode-2 oscillation branch	agent1	branch_search	1	-0.000000
exp446	1.00593755e-14	1.001296	-1.000019	discard	Fourier N=16 cos IC amp=1.0 phase=pi/4 offset=0 — mixed parity	agent0	branch_search	0	-1.520844
exp447	crash	0	0	crash	Fourier N=64 sin IC amp=0.1 offset=0 — characterize 4th branch norm=0.07	agent0	branch_search	0	0
exp448	1.44422015e-15	0.070536	0.000000	discard	Fourier N=16 sin IC amp=0.1 offset=0 — 4th branch characterization	agent0	branch_search	0	0.000099
exp449	9.51736756e-16	0.070536	0.000000	discard	Fourier N=16 sin IC amp=0.5 offset=0 — 4th branch stability check	agent0	branch_search	0	0.000099
exp450	1.74438849e-17	0.000000	-0.000000	discard	Fourier N=32 mode-2 cos IC amp=0.5 offset=0 — search for mode-2 branch	agent0	branch_search	0	-0.000000
exp451	crash	0	0	crash	Fourier N=64 sin IC amp=0.5 phase=pi/2 offset=0 — push 4th branch residual down	agent1	branch_search	0	0
exp452	4.53091131e-15	0.070536	0.000000	discard	Fourier N=32 mode-2 sin IC amp=0.5 offset=0 — mode-2 odd branch	agent0	branch_search	0	0.000099
exp453	2.42920086e-16	0.070536	-0.000000	discard	Fourier N=8 sin IC amp=0.5 phase=pi/2 offset=0 500 Newton iters — push 4th branch residual	agent1	branch_search	1	0.000099
exp454	5.11505881e-16	0.070536	-0.000000	discard	Fourier N=16 sin IC amp=0.5 phase=pi/2 offset=0 500iter — 4th branch N=16	agent1	branch_search	1	0.000099
exp455	2.30604361e-15	0.070536	0.000000	discard	Fourier N=16 -sin IC amp=0.1 offset=0 — negative 4th branch (u to -u symmetry)	agent0	branch_search	1	0.000099
exp456	4.81950656e-16	0.000006	0.000000	discard	Fourier N=2 sin IC amp=0.5 phase=pi/2 offset=0 500iter — minimize modes for 4th branch	agent1	branch_search	0	-0.000000
exp457	3.89720378e-17	0.070535	-0.000000	discard	Fourier N=4 sin IC amp=0.5 phase=pi/2 offset=0 500iter — N=4 for 4th branch	agent1	branch_search	0	0.000099
exp458	1.10899348e-16	0.070536	0.000000	discard	Fourier N=5 sin IC amp=0.5 phase=pi/2 offset=0 500iter — sweep N for 4th branch	agent1	branch_search	0	0.000099
exp459	7.83342496e-17	0.070536	-0.000000	discard	Fourier N=6 sin IC amp=0.5 phase=pi/2 offset=0 500iter — sweep N for 4th branch	agent1	branch_search	0	0.000099
exp460	crash	0	0	crash	scipy sin IC amp=0.07 phase=pi/2 n=300 tol=1e-12 — target 4th branch via scipy	agent1	branch_search	0	0
exp461	9.99174588e-12	0.070536	0.000000	discard	scipy sin IC amp=0.5 phase=pi/2 n=300 tol=1e-11 — larger amp for 4th branch via scipy	agent1	branch_search	0	0.000175
exp462	crash	0	0	crash	scipy sin IC amp=0.5 phase=pi/2 n=300 tol=1e-14 — push scipy tighter for 4th branch	agent1	solver_param	1	0
exp463	crash	0	0	crash	Fourier N=32 cos IC amp=1.0 offset=0 — search for domain wall solution cos start	agent1	branch_search	1	0
exp464	2.14282669e-16	0.070535	0.000000	discard	Fourier N=4 mode-2 sin IC amp=0.5 offset=0 — search for mode-2 bifurcation	agent1	branch_search	0	0.000099
exp465	1.44422015e-15	0.070536	0.000000	discard	Fourier N=16 sin+ branch: norm=0.07 mean=0 — bifurcation from trivial at mode-1	agent0	branch_search	1	0.000099
exp466	5.30892590e-25	0.000000	0.000000	discard	Fourier N=4 cos IC amp=0.5 phase=0 offset=0 — even parity branch search	agent1	branch_search	1	0.000000
exp467	5.93738720e-25	0.000000	0.000000	discard	Fourier N=8 mode-3 sin IC amp=0.5 offset=0 — search for mode-3 branch	agent1	branch_search	0	0.000000
exp468	crash	0	0	crash	Fourier N=64 u_offset=0.9 — positive branch via Fourier spectral	agent1	initial_cond	1	0
exp469	2.66626099e-13	1.001296	1.000019	discard	Fourier N=64 u_offset=0.9 tol=1e-12 500iter — positive branch relaxed tol	agent1	initial_cond	0	-1.520844
exp470	crash	0	0	crash	Fourier N=128 u_offset=0.9 tol=1e-14 — positive branch high res	agent1	initial_cond	1	0
exp471	1.39574569e-19	0.000000	-0.000000	discard	scipy sin-like IC amp=0.07 offset=0 n=200 tol=1e-12 — test 4th branch via scipy	agent0	branch_search	1	-0.000000
exp472	crash	0	0	crash	scipy sin IC amp=0.5 phase=pi/2 offset=0 n=300 tol=1e-12 — replicate Fourier 4th branch via scipy	agent0	branch_search	0	0
exp473	crash	0	0	crash	Fourier N=128 u_offset=0.9 tol=1e-12 — positive branch at 128 modes	agent1	initial_cond	1	0
exp474	crash	0	0	crash	Fourier N=32 u_offset=0.9 tol=1e-14 — positive branch N=32	agent1	initial_cond	0	0
exp475	9.51736756e-16	0.070536	0.000000	discard	Fourier N=16 sin IC amp=0.5 phase=pi/2 offset=0 — 4th branch N-convergence test	agent0	branch_search	0	0.000099
exp476	4.80663524e-15	0.070536	0.000000	discard	Fourier N=32 sin IC amp=0.5 phase=pi/2 offset=0 — 4th branch N=32 convergence	agent0	branch_search	0	0.000099
exp477	crash	0	0	crash	Fourier N=64 sin IC amp=0.5 phase=pi/2 offset=0 — 4th branch N=64 convergence	agent0	branch_search	1	0
exp478	2.66626099e-13	1.001296	-1.000019	discard	Fourier N=64 u_offset=-0.9 tol=1e-12 — negative branch Fourier	agent1	initial_cond	0	-1.520844
exp479	crash	0	0	crash	Fourier N=64 sin IC amp=0.5 offset=0 — test 0.07 branch at high N	agent1	branch_search	1	0
exp480	2.66201844e-14	0.070536	0.000000	discard	Fourier N=64 sin IC phase=pi/2 offset=0 tol=1e-12 500iter — 4th branch convergence	agent0	branch_search	0	0.000099
exp481	2.66201844e-14	0.070536	0.000000	discard	Fourier N=64 sin IC amp=0.5 tol=1e-13 — test if 0.07 branch exists at N=64	agent1	branch_search	0	0.000099
exp482	9.96485626e-12	0.070536	0.000000	discard	scipy sin IC amp=0.07 n=200 tol=1e-11 — verify 4th branch with scipy	agent1	branch_search	1	0.000175
exp483	3.43525288e-15	0.070536	0.000000	discard	Fourier N=16 sin IC amp=0.5 phase=3pi/2 offset=0 — check -u is distinct 5th branch	agent0	branch_search	0	0.000099
exp484	2.44485099e-14	0.070536	-0.000000	discard	Fourier N=64 -sin IC amp=0.5 phase=3pi/2 — search for Z2-mirror of 0.07 branch	agent1	branch_search	0	0.000099
exp485	1.07532507e-23	0.000000	0.000000	discard	Fourier N=16 cos IC amp=0.5 phase=0 offset=0 — search for even-parity 4th branch	agent0	branch_search	1	-0.000000
exp486	1.74862376e-17	0.000000	-0.000000	discard	Fourier N=64 mode-2 cos IC amp=0.5 offset=0 — search for mode-2 branch	agent1	branch_search	0	-0.000000
exp487	1.74827109e-17	0.000000	-0.000000	discard	Fourier N=16 mode-2 cos IC amp=0.5 offset=0 — search for mode-2 branch	agent0	branch_search	0	-0.000000
exp488	1.49375752e-14	0.070536	-0.000000	discard	Fourier N=64 mode-2 sin IC amp=0.5 offset=0 — mode-2 sin branch search	agent1	branch_search	0	0.000099
exp489	2.39690169e-15	0.070536	0.000000	discard	Fourier N=16 mode-2 sin IC amp=0.5 offset=0 — search for mode-2 sin branch	agent0	branch_search	0	0.000099
exp490	4.25717734e-20	0.000000	0.000000	discard	Fourier N=64 mode-2 cos amp=1.5 offset=0 — large mode-2 for exotic branch	agent1	branch_search	0	0.000000
exp491	5.84440146e-14	1.001296	1.000019	discard	Fourier N=32 cos IC amp=1.0 offset=0 — large amp cos IC for domain wall solution	agent0	branch_search	0	-1.520844
exp492	crash	0	0	crash	Fourier N=64 cos IC amp=0.5 offset=0.5 — mixed initial guess for exotic branch	agent1	branch_search	3	0
exp493	6.69529963e-14	1.001296	1.000019	discard	Fourier N=32 cos IC amp=1.5 offset=0 — very large amplitude for domain wall	agent0	branch_search	0	-1.520844
exp494	3.88556480e-14	0.070536	-0.000000	discard	Fourier N=32 sin IC amp=1.5 offset=0 — large sin amplitude for new branch	agent0	branch_search	0	0.000099
exp495	crash	0	0	crash	Fourier N=128 sin IC amp=0.5 tol=1e-14 — push 0.07 branch residual lower	agent1	branch_search	1	0
exp496	crash	0	0	crash	Fourier N=16 amp=0.5 phase=pi/4 offset=0.5 — mixed cos+sin IC for asymmetric branch	agent0	branch_search	0	0
exp497	7.06154012e-15	1.001296	1.000019	discard	Fourier N=16 amp=0.5 phase=pi/4 offset=0.5 tol=1e-12 — mixed IC relaxed tol	agent0	branch_search	1	-1.520844
exp498	crash	0	0	crash	Fourier N=96 sin IC amp=0.5 tol=1e-14 — sweep N for 0.07 branch	agent1	branch_search	10	0
exp499	crash	0	0	crash	Fourier N=32 mode-2 sin IC amp=0.5 tol=1e-15 — push 0.07 branch residual lower	agent0	branch_search	0	0
exp500	1.32601884e-27	0.000000	-0.000000	discard	Fourier N=8 mode-3 cos IC amp=0.5 offset=0 — search for mode-3 branch	agent1	branch_search	1	0.000000
exp501	crash	0	0	crash	Fourier N=8 mode-2 sin IC amp=0.5 tol=1e-16 500iter — push 0.07 branch residual	agent0	branch_search	1	0
exp502	5.93738720e-25	0.000000	0.000000	discard	Fourier N=8 mode-3 sin IC amp=0.5 offset=0 — search for mode-3 branch	agent1	branch_search	0	0.000000
exp503	1.25641427e-19	0.000000	-0.000000	discard	scipy mode-2 sin IC n=300 tol=1e-14 — push 4th branch residual via scipy	agent1	branch_search	0	0.000000
exp504	2.22945995e-15	0.070536	0.000000	discard	Fourier N=10 mode-2 sin IC amp=0.5 tol=1e-14 — push 0.07 branch with more modes	agent0	branch_search	1	0.000099
exp505	4.31529236e-27	0.000000	0.000000	discard	Fourier N=8 mode-3 cos amp=1.5 offset=0 500iter — large amp mode-3	agent1	branch_search	1	0.000000
exp506	5.56231378e-15	0.070536	0.000000	discard	Fourier N=6 mode-2 sin IC amp=0.5 — test if fewer modes give lower residual on 0.07 branch	agent0	branch_search	0	0.000099
exp507	crash	0	0	crash	Fourier N=8 mode-3 cos amp=0.5 offset=0.5 — mode-3 with DC offset	agent1	branch_search	1	0
exp508	1.32601884e-27	0.000000	-0.000000	discard	Fourier N=8 mode-3 cos IC amp=0.5 offset=0 — search for mode-3 branch	agent0	branch_search	1	0.000000
exp509	4.81950656e-16	0.000006	0.000000	discard	Fourier N=2 sin IC amp=0.5 offset=0 — minimum modes 4th branch	agent1	branch_search	0	-0.000000
exp510	2.35345540e-15	1.001296	1.000019	discard	Fourier N=8 mode-3 cos amp=1.5 offset=0.5 — force mode-3 branch with large IC	agent0	branch_search	0	-1.520844
exp511	4.04811706e-17	0.070278	-0.000000	discard	Fourier N=3 sin IC amp=0.5 offset=0 — 4th branch optimal modes	agent1	branch_search	0	0.000097
exp512	5.52949034e-15	1.001296	1.000019	discard	Fourier N=16 mode-1 cos amp=1.0 offset=0 — cos IC at bifurcation amplitude for new branch	agent0	branch_search	1	-1.520844
exp513	3.42818300e-15	0.000000	0.000000	discard	Scipy mode-2 sin IC amp=0.5 offset=0 — check if 0.07 branch exists in continuous limit	agent0	branch_search	0	0.000000
exp514	crash	0	0	crash	Fourier N=32 cos IC amp=1.0 offset=0 — domain wall search	agent1	branch_search	0	0
exp515	crash	0	0	crash	Scipy n=300 tol=1e-12 u_offset=-0.9 — push negative branch residual below 9e-27	agent0	solver_param	0	0
