exp_id	residual	solution_norm	solution_mean	status	description	agent	design	elapsed_s	solution_energy
exp516	5.84440146e-14	1.001296	1.000019	discard	Fourier N=32 cos IC amp=1.0 offset=0 500iter tol=1e-12 — domain wall	agent1	branch_search	0	-1.520844
exp517	crash	0	0	crash	Fourier N=64 offset=0.9 amp=0 tol=1e-15 — push positive branch with spectral solver	agent0	solver_param	1	0
exp518	crash	0	0	crash	Fourier N=32 offset=0.9 amp=0.1 tol=1e-14 — push positive branch with smaller N	agent0	solver_param	0	0
exp519	1.40825974e-14	1.001296	1.000019	discard	Fourier N=16 cos amp=1.0 offset=0.3 — basin boundary near cos IC	agent1	branch_search	0	-1.520844
exp520	1.20937238e-14	1.001296	1.000019	discard	Fourier N=16 cos amp=1.0 offset=-0.3 — basin boundary negative side	agent1	branch_search	0	-1.520844
exp521	3.74513825e-12	0.000000	-0.000000	discard	Scipy mode-1 cos amp=0.5 offset=0 — domain wall IC (cos oscillation around 0)	agent0	branch_search	0	-0.000000
exp522	7.80043809e-20	0.000000	-0.000000	discard	Fourier N=16 mode-4 sin IC amp=0.5 offset=0 — search for mode-4 branch	agent1	branch_search	0	0.000000
exp523	8.81934685e-11	1.002503	1.000218	discard	Scipy offset=1.0 cos amp=0.5 — positive branch with strong mode-1 perturbation	agent0	perturbation	0	-1.523848
exp524	3.38204386e-22	0.000000	-0.000000	discard	Fourier N=16 mode-5 sin IC amp=0.5 offset=0 — search for mode-5 branch	agent1	branch_search	0	0.000000
exp525	crash	0	0	crash	Scipy mode-1 cos amp=1.5 offset=0 n=300 — symmetric IC crossing both wells	agent0	branch_search	1	0
exp526	1.74827109e-17	0.000000	-0.000000	discard	Fourier N=16 mode-2 cos IC amp=0.5 offset=0 — mode-2 cos branch search	agent1	branch_search	0	-0.000000
exp527	8.08630458e-15	1.001296	1.000019	discard	Fourier N=16 cos amp=1.5 offset=0 — large symmetric IC for kink-antikink	agent0	branch_search	1	-1.520844
exp528	crash	0	0	crash	Fourier N=32 offset=0.9 tol=1e-14 — positive branch high-res	agent0	solver_param	0	0
exp529	3.91750443e-15	1.001296	1.000019	discard	Fourier N=16 offset=0.9 amp=0.1 tol=1e-14 — positive branch baseline	agent0	initial_cond	0	-1.520844
exp530	crash	0	0	crash	Fourier N=16 offset=-0.9 amp=0.1 tol=1e-14 — negative branch baseline	agent0	initial_cond	1	0
exp531	9.80524062e-14	1.001296	-1.000019	discard	Fourier N=16 offset=-0.9 tol=1e-12 — negative branch relaxed tol	agent0	initial_cond	1	-1.520844
exp532	0.00000000e+00	0.000000	0.000000	discard	Fourier N=16 offset=0.0 amp=0.0 tol=1e-14 — trivial branch exact zero IC	agent0	initial_cond	1	0.000000
exp533	2.98100769e-14	0.000000	0.000000	discard	Fourier N=16 offset=0.1 amp=0 — basin boundary sweep positive	agent0	branch_search	1	-0.000000
exp534	5.61534557e-20	0.000000	0.000000	discard	Fourier N=16 offset=0.2 amp=0 — basin boundary sweep positive	agent0	branch_search	0	-0.000000
exp535	3.15314653e-21	0.000000	0.000000	discard	Fourier N=16 offset=0.3 amp=0 — basin boundary sweep positive	agent0	branch_search	0	-0.000000
exp536	2.94891172e-22	0.000000	-0.000000	discard	Fourier N=16 offset=0.4 amp=0 — basin boundary sweep positive	agent0	branch_search	1	-0.000000
exp537	4.99832888e-14	1.001296	-1.000019	discard	Fourier N=16 offset=0.5 amp=0 — basin boundary sweep positive	agent0	branch_search	0	-1.520844
exp538	3.35642799e-14	1.001296	1.000019	discard	Fourier N=16 offset=0.6 amp=0 — basin boundary sweep positive	agent0	branch_search	0	-1.520844
exp539	1.04325460e-14	1.001296	1.000019	discard	Fourier N=16 offset=0.7 amp=0 — basin boundary sweep positive	agent0	branch_search	1	-1.520844
exp540	3.17158955e-14	1.001296	1.000019	discard	Fourier N=16 offset=0.8 amp=0 — basin boundary sweep positive	agent0	branch_search	0	-1.520844
exp541	crash	0	0	crash	Fourier N=64 positive u_offset=0.9 newton_tol=1e-14	agent1	initial_cond	1	0
exp542	5.29239402e-18	0.000000	0.000000	discard	Fourier N=16 offset=0.41 amp=0 — boundary refinement	agent0	branch_search	0	-0.000000
exp543	2.52333380e-13	0.000000	0.000000	discard	Fourier N=16 offset=0.42 amp=0 — boundary refinement	agent0	branch_search	0	-0.000000
exp544	6.47734063e-22	0.000000	-0.000000	discard	Fourier N=16 offset=0.43 amp=0 — boundary refinement	agent0	branch_search	1	0.000000
exp545	2.23894594e-13	0.000000	0.000000	discard	Fourier N=16 offset=0.44 amp=0 — boundary refinement	agent0	branch_search	0	-0.000000
exp546	3.94751534e-16	0.000000	0.000000	discard	Fourier N=16 offset=0.45 amp=0 — boundary refinement	agent0	branch_search	0	-0.000000
exp547	3.37350668e-24	0.000000	-0.000000	discard	Fourier N=16 offset=0.46 amp=0 — boundary refinement	agent0	branch_search	1	-0.000000
exp548	1.09663522e-14	1.001296	-1.000019	discard	Fourier N=16 offset=0.47 amp=0 — boundary refinement	agent0	branch_search	0	-1.520844
exp549	3.34840026e-14	1.001296	1.000019	discard	Fourier N=16 offset=0.48 amp=0 — boundary refinement	agent0	branch_search	0	-1.520844
exp550	3.20990933e-14	1.001296	-1.000019	discard	Fourier N=16 offset=0.49 amp=0 — boundary refinement	agent0	branch_search	1	-1.520844
exp551	2.44575072e-19	0.000000	0.000000	discard	Fourier N=16 offset=0.461 — fine boundary	agent0	branch_search	0	-0.000000
exp552	5.32681764e-20	0.000000	0.000000	discard	Fourier N=16 offset=0.462 — fine boundary	agent0	branch_search	0	-0.000000
exp553	1.71382580e-14	1.001296	-1.000019	discard	Fourier N=16 offset=0.463 — fine boundary	agent0	branch_search	1	-1.520844
exp554	1.11451541e-14	1.001296	-1.000019	discard	Fourier N=16 offset=0.464 — fine boundary	agent0	branch_search	0	-1.520844
exp555	1.17968116e-14	1.001296	-1.000019	discard	Fourier N=16 offset=0.465 — fine boundary	agent0	branch_search	0	-1.520844
exp556	1.90492616e-14	1.001296	1.000019	discard	Fourier N=16 offset=0.466 — fine boundary	agent0	branch_search	1	-1.520844
exp557	1.07806334e-14	1.001296	-1.000019	discard	Fourier N=16 offset=0.467 — fine boundary	agent0	branch_search	0	-1.520844
exp558	3.06128960e-14	1.001296	-1.000019	discard	Fourier N=16 offset=0.468 — fine boundary	agent0	branch_search	0	-1.520844
exp559	1.37477316e-14	1.001296	-1.000019	discard	Fourier N=16 offset=0.469 — fine boundary	agent0	branch_search	1	-1.520844
exp560	1.09663522e-14	1.001296	-1.000019	discard	Fourier N=16 offset=0.470 — fine boundary	agent0	branch_search	0	-1.520844
exp561	2.66626099e-13	1.001296	1.000019	discard	Fourier N=64 positive u_offset=0.9 newton_tol=1e-12	agent1	initial_cond	1	-1.520844
exp562	2.98100769e-14	0.000000	-0.000000	discard	Fourier N=16 offset=-0.1 — negative side boundary	agent0	branch_search	0	-0.000000
exp563	5.61534557e-20	0.000000	-0.000000	discard	Fourier N=16 offset=-0.2 — negative side boundary	agent0	branch_search	1	-0.000000
exp564	3.15314653e-21	0.000000	-0.000000	discard	Fourier N=16 offset=-0.3 — negative side boundary	agent0	branch_search	0	-0.000000
exp565	2.94891172e-22	0.000000	0.000000	discard	Fourier N=16 offset=-0.4 — negative side boundary	agent0	branch_search	0	-0.000000
exp566	3.94751534e-16	0.000000	-0.000000	discard	Fourier N=16 offset=-0.45 — negative side boundary	agent0	branch_search	1	-0.000000
exp567	3.37350668e-24	0.000000	0.000000	discard	Fourier N=16 offset=-0.46 — negative side boundary	agent0	branch_search	0	-0.000000
exp568	1.09663522e-14	1.001296	1.000019	discard	Fourier N=16 offset=-0.47 — negative side boundary	agent0	branch_search	0	-1.520844
exp569	3.34840026e-14	1.001296	-1.000019	discard	Fourier N=16 offset=-0.48 — negative side boundary	agent0	branch_search	1	-1.520844
exp570	3.20990933e-14	1.001296	1.000019	discard	Fourier N=16 offset=-0.49 — negative side boundary	agent0	branch_search	0	-1.520844
exp571	4.99832888e-14	1.001296	1.000019	discard	Fourier N=16 offset=-0.5 — negative side boundary	agent0	branch_search	0	-1.520844
exp572	3.35642799e-14	1.001296	-1.000019	discard	Fourier N=16 offset=-0.6 — negative side boundary	agent0	branch_search	1	-1.520844
exp573	1.04325460e-14	1.001296	-1.000019	discard	Fourier N=16 offset=-0.7 — negative side boundary	agent0	branch_search	0	-1.520844
exp574	3.17158955e-14	1.001296	-1.000019	discard	Fourier N=16 offset=-0.8 — negative side boundary	agent0	branch_search	0	-1.520844
exp575	3.26514669e-14	1.001296	-1.000019	discard	Fourier N=16 offset=-0.9 — negative side boundary	agent0	branch_search	1	-1.520844
exp576	crash	0	0	crash	Fourier N=128 positive u_offset=0.9 newton_tol=1e-13	agent1	initial_cond	0	0
exp577	4.52786698e-25	0.000000	0.000000	discard	Fourier amp=0.05 offset=0.40 — amplitude effect on boundary	agent0	perturbation	0	-0.000000
exp578	1.24434321e-13	1.001296	1.000019	discard	Fourier amp=0.05 offset=0.45 — amplitude effect on boundary	agent0	perturbation	1	-1.520844
exp579	1.42660414e-14	1.001296	1.000019	discard	Fourier amp=0.05 offset=0.46 — amplitude effect on boundary	agent0	perturbation	0	-1.520844
exp580	8.32417569e-15	1.001296	-1.000019	discard	Fourier amp=0.05 offset=0.47 — amplitude effect on boundary	agent0	perturbation	0	-1.520844
exp581	3.23182870e-14	1.001296	-1.000019	discard	Fourier amp=0.05 offset=0.50 — amplitude effect on boundary	agent0	perturbation	1	-1.520844
exp582	6.06955971e-15	0.000000	-0.000000	discard	Fourier amp=0.1 offset=0.40 — amplitude effect on boundary	agent0	perturbation	0	-0.000000
exp583	1.32824281e-14	1.001296	1.000019	discard	Fourier amp=0.1 offset=0.45 — amplitude effect on boundary	agent0	perturbation	0	-1.520844
exp584	1.25313265e-14	1.001296	1.000019	discard	Fourier amp=0.1 offset=0.46 — amplitude effect on boundary	agent0	perturbation	1	-1.520844
exp585	1.38296971e-14	1.001296	-1.000019	discard	Fourier amp=0.1 offset=0.47 — amplitude effect on boundary	agent0	perturbation	0	-1.520844
exp586	crash	0	0	crash	Fourier N=32 positive u_offset=0.9 newton_tol=1e-14	agent1	initial_cond	0	0
exp587	3.16104525e-14	1.001296	-1.000019	discard	Fourier amp=0.1 offset=0.50 — amplitude effect on boundary	agent0	perturbation	0	-1.520844
exp588	5.41086732e-19	0.000000	-0.000000	discard	Fourier amp=0.15 offset=0.40 — amplitude effect on boundary	agent0	perturbation	1	-0.000000
exp589	2.60411450e-14	0.000000	-0.000000	discard	Fourier amp=0.15 offset=0.45 — amplitude effect on boundary	agent0	perturbation	0	-0.000000
exp590	3.17443473e-14	1.001296	1.000019	discard	Fourier amp=0.15 offset=0.46 — amplitude effect on boundary	agent0	perturbation	0	-1.520844
exp591	1.25602611e-14	1.001296	1.000019	discard	Fourier amp=0.15 offset=0.47 — amplitude effect on boundary	agent0	perturbation	1	-1.520844
exp592	3.29512266e-14	1.001296	-1.000019	discard	Fourier amp=0.15 offset=0.50 — amplitude effect on boundary	agent0	perturbation	0	-1.520844
exp593	1.84301912e-13	0.000000	-0.000000	discard	Fourier amp=0.2 offset=0.40 — amplitude effect on boundary	agent0	perturbation	0	-0.000000
exp594	1.47186496e-21	0.000000	-0.000000	discard	Fourier amp=0.2 offset=0.45 — amplitude effect on boundary	agent0	perturbation	1	-0.000000
exp595	1.48341394e-14	1.001296	-1.000019	discard	Fourier amp=0.2 offset=0.46 — amplitude effect on boundary	agent0	perturbation	0	-1.520844
exp596	1.03219763e-14	1.001296	-1.000019	discard	Fourier amp=0.2 offset=0.47 — amplitude effect on boundary	agent0	perturbation	0	-1.520844
exp597	3.38732401e-14	1.001296	-1.000019	discard	Fourier amp=0.2 offset=0.50 — amplitude effect on boundary	agent0	perturbation	1	-1.520844
exp598	1.41128388e-21	0.000000	-0.000000	discard	Fourier amp=0.3 offset=0.40 — amplitude effect on boundary	agent0	perturbation	0	-0.000000
exp599	1.11210739e-19	0.000000	-0.000000	discard	Fourier amp=0.3 offset=0.45 — amplitude effect on boundary	agent0	perturbation	0	-0.000000
exp600	1.24135084e-14	1.001296	-1.000019	discard	Fourier amp=0.3 offset=0.46 — amplitude effect on boundary	agent0	perturbation	1	-1.520844
exp601	1.13600204e-14	1.001296	-1.000019	discard	Fourier amp=0.3 offset=0.47 — amplitude effect on boundary	agent0	perturbation	0	-1.520844
exp602	3.20357725e-14	1.001296	1.000019	discard	Fourier amp=0.3 offset=0.50 — amplitude effect on boundary	agent0	perturbation	0	-1.520844
exp603	2.36855751e-14	1.001296	-1.000019	discard	Fourier offset=-0.9 phase=0.0 amp=0.05 — negative branch optimization	agent0	solver_param	0	-1.520844
exp604	5.52949034e-15	1.001296	1.000019	discard	Fourier N=16 positive u_offset=0.9 newton_tol=1e-14	agent1	initial_cond	0	-1.520844
exp605	9.80524062e-14	1.001296	-1.000019	discard	Fourier offset=-0.9 phase=0.0 amp=0.1 — negative branch optimization	agent0	solver_param	1	-1.520844
exp606	1.10121759e-14	1.001296	-1.000019	discard	Fourier offset=-0.9 phase=0.0 amp=0.15 — negative branch optimization	agent0	solver_param	0	-1.520844
exp607	3.37142730e-14	1.001296	-1.000019	discard	Fourier offset=-0.9 phase=3.14159 amp=0.05 — negative branch optimization	agent0	solver_param	0	-1.520844
exp608	5.73479152e-13	1.001296	-1.000019	discard	Fourier offset=-0.9 phase=3.14159 amp=0.1 — negative branch optimization	agent0	solver_param	1	-1.520844
exp609	2.08738544e-14	1.001296	-1.000019	discard	Fourier offset=-0.9 phase=3.14159 amp=0.15 — negative branch optimization	agent0	solver_param	0	-1.520844
exp610	2.94474458e-15	1.001296	1.000019	discard	Fourier N=8 positive u_offset=0.9 newton_tol=1e-14	agent1	initial_cond	0	-1.520844
exp611	5.73474660e-13	1.001296	1.000019	discard	Fourier N=8 offset=0.9 — positive branch modes test	agent0	solver_param	0	-1.520844
exp612	3.61445435e-15	1.001296	-1.000019	discard	Fourier N=8 offset=-0.9 — negative branch modes test	agent0	solver_param	0	-1.520844
exp613	5.73395961e-13	1.001296	1.000019	discard	Fourier N=12 offset=0.9 — positive branch modes test	agent0	solver_param	1	-1.520844
exp614	1.12829018e-14	1.001296	-1.000019	discard	Fourier N=12 offset=-0.9 — negative branch modes test	agent0	solver_param	0	-1.520844
exp615	5.75230527e-13	1.001296	1.000019	discard	Fourier N=24 offset=0.9 — positive branch modes test	agent0	solver_param	0	-1.520844
exp616	4.78867950e-14	1.001296	-1.000019	discard	Fourier N=24 offset=-0.9 — negative branch modes test	agent0	solver_param	1	-1.520844
exp617	2.57581612e-16	1.001296	1.000019	discard	Fourier N=4 positive u_offset=0.9 newton_tol=1e-14	agent1	initial_cond	0	-1.520844
exp618	9.08038449e-15	1.001296	1.000019	discard	Fourier N=8 offset=0.8 amp=0.0 — positive branch N=8	agent0	solver_param	1	-1.520844
exp619	4.38824831e-13	1.001296	1.000019	discard	Fourier N=8 offset=0.8 amp=0.05 — positive branch N=8	agent0	solver_param	0	-1.520844
exp620	7.12165277e-14	1.001296	1.000019	discard	Fourier N=8 offset=0.8 amp=0.1 — positive branch N=8	agent0	solver_param	0	-1.520844
exp621	8.98769634e-15	1.001296	1.000019	discard	Fourier N=8 offset=0.8 amp=0.15 — positive branch N=8	agent0	solver_param	0	-1.520844
exp622	2.94474458e-15	1.001296	1.000019	discard	Fourier N=8 offset=0.9 amp=0.0 — positive branch N=8	agent0	solver_param	0	-1.520844
exp623	2.33934795e-15	1.001296	1.000019	discard	Fourier N=8 offset=0.9 amp=0.05 — positive branch N=8	agent0	solver_param	0	-1.520844
exp624	5.73474660e-13	1.001296	1.000019	discard	Fourier N=8 offset=0.9 amp=0.1 — positive branch N=8	agent0	solver_param	1	-1.520844
exp625	2.00148302e-16	1.001298	1.000025	discard	Fourier N=2 positive u_offset=0.9 newton_tol=1e-14	agent1	initial_cond	1	-1.520921
exp626	2.46573935e-15	1.001296	1.000019	discard	Fourier N=8 offset=0.9 amp=0.15 — positive branch N=8	agent0	solver_param	0	-1.520844
exp627	2.90447551e-15	1.001296	1.000019	discard	Fourier N=8 offset=1.0 amp=0.0 — positive branch N=8	agent0	solver_param	0	-1.520844
exp628	2.23098526e-15	1.001296	1.000019	discard	Fourier N=8 offset=1.0 amp=0.05 — positive branch N=8	agent0	solver_param	1	-1.520844
exp629	1.02308882e-14	1.001296	1.000019	discard	Fourier N=8 offset=1.0 amp=0.1 — positive branch N=8	agent0	solver_param	0	-1.520844
exp630	2.05183690e-15	1.001296	1.000019	discard	Fourier N=8 offset=1.0 amp=0.15 — positive branch N=8	agent0	solver_param	0	-1.520844
exp631	9.11016463e-15	1.001296	1.000019	discard	Fourier N=8 offset=1.1 amp=0.0 — positive branch N=8	agent0	solver_param	1	-1.520844
exp632	1.56233385e-13	1.001296	1.000019	discard	Fourier N=8 offset=1.1 amp=0.05 — positive branch N=8	agent0	solver_param	0	-1.520844
exp633	1.43811231e-14	1.001296	1.000019	discard	Fourier N=8 offset=1.1 amp=0.1 — positive branch N=8	agent0	solver_param	0	-1.520844
exp634	1.29390100e-13	1.001296	1.000019	discard	Fourier N=8 offset=1.1 amp=0.15 — positive branch N=8	agent0	solver_param	1	-1.520844
exp635	4.37618166e-16	1.001296	1.000019	discard	Fourier N=3 positive u_offset=0.9 newton_tol=1e-14	agent1	initial_cond	0	-1.520844
exp636	2.57581612e-16	1.001296	1.000019	discard	Fourier N=4 offset=0.9 amp=0.0 — minimal modes positive	agent0	solver_param	0	-1.520844
exp637	1.86448479e-16	1.001296	1.000019	discard	Fourier N=4 offset=0.9 amp=0.05 — minimal modes positive	agent0	solver_param	1	-1.520844
exp638	2.06774381e-16	1.001296	1.000019	discard	Fourier N=4 offset=0.9 amp=0.1 — minimal modes positive	agent0	solver_param	0	-1.520844
exp639	1.86448479e-16	1.001296	1.000019	discard	Fourier N=4 offset=0.9 amp=0.15 — minimal modes positive	agent0	solver_param	0	-1.520844
exp640	1.89920454e-15	1.001296	1.000019	discard	Fourier N=4 offset=1.0 amp=0.0 — minimal modes positive	agent0	solver_param	1	-1.520844
exp641	2.57581612e-16	1.001296	1.000019	discard	Fourier N=4 offset=1.0 amp=0.05 — minimal modes positive	agent0	solver_param	0	-1.520844
exp642	1.96261557e-16	1.001296	1.000019	discard	Fourier N=4 offset=1.0 amp=0.1 — minimal modes positive	agent0	solver_param	0	-1.520844
exp643	2.06774381e-16	1.001296	1.000019	discard	Fourier N=4 offset=1.0 amp=0.15 — minimal modes positive	agent0	solver_param	1	-1.520844
exp644	2.57581612e-16	1.001296	-1.000019	discard	Fourier N=4 offset=-0.9 amp=0.0 — minimal modes negative	agent0	solver_param	0	-1.520844
exp645	3.14171784e-16	1.001296	-1.000019	discard	Fourier N=4 offset=-0.9 amp=0.05 — minimal modes negative	agent0	solver_param	0	-1.520844
exp646	4.00777441e-16	1.001296	-1.000019	discard	Fourier N=4 offset=-0.9 amp=0.15 — minimal modes negative	agent0	solver_param	1	-1.520844
exp647	1.89920454e-15	1.001296	-1.000019	discard	Fourier N=4 offset=-1.0 amp=0.0 — minimal modes negative	agent0	solver_param	0	-1.520844
exp648	5.55111512e-17	1.001322	1.000049	discard	Fourier N=1 positive u_offset=0.9 newton_tol=1e-15	agent1	initial_cond	0	-1.520921
exp649	2.57581612e-16	1.001296	-1.000019	discard	Fourier N=4 offset=-1.0 amp=0.05 — minimal modes negative	agent0	solver_param	0	-1.520844
exp650	3.86154346e-16	1.001296	-1.000019	discard	Fourier N=4 offset=-1.0 amp=0.15 — minimal modes negative	agent0	solver_param	1	-1.520844
exp651	2.00148302e-16	1.001298	1.000025	discard	Fourier N=2 offset=0.9 amp=0.0 — ultra-low modes	agent0	solver_param	0	-1.520921
exp652	2.51337427e-16	1.001298	1.000025	discard	Fourier N=2 offset=0.9 amp=0.05 — ultra-low modes	agent0	solver_param	1	-1.520921
exp653	2.00148302e-16	1.001298	1.000025	discard	Fourier N=2 offset=0.9 amp=0.1 — ultra-low modes	agent0	solver_param	0	-1.520921
exp654	2.00148302e-16	1.001298	-1.000025	discard	Fourier N=2 offset=-0.9 amp=0.0 — ultra-low modes	agent0	solver_param	0	-1.520921
exp655	5.11787527e-16	1.001298	-1.000025	discard	Fourier N=2 offset=-0.9 amp=0.05 — ultra-low modes	agent0	solver_param	1	-1.520921
exp656	2.00148302e-16	1.001298	-1.000025	discard	Fourier N=2 offset=-0.9 amp=0.1 — ultra-low modes	agent0	solver_param	0	-1.520921
exp657	4.37618166e-16	1.001296	1.000019	discard	Fourier N=3 offset=0.9 amp=0.0 — ultra-low modes	agent0	solver_param	0	-1.520844
exp658	1.85974439e-16	1.001296	1.000019	discard	Fourier N=3 offset=0.9 amp=0.05 — ultra-low modes	agent0	solver_param	1	-1.520844
exp659	6.01446416e-16	1.001296	1.000019	discard	Fourier N=3 offset=0.9 amp=0.1 — ultra-low modes	agent0	solver_param	0	-1.520844
exp660	4.37618166e-16	1.001296	-1.000019	discard	Fourier N=3 offset=-0.9 amp=0.0 — ultra-low modes	agent0	solver_param	0	-1.520844
exp661	2.13062840e-16	1.001296	-1.000019	discard	Fourier N=3 offset=-0.9 amp=0.05 — ultra-low modes	agent0	solver_param	1	-1.520844
exp662	4.37618166e-16	1.001296	-1.000019	discard	Fourier N=3 offset=-0.9 amp=0.1 — ultra-low modes	agent0	solver_param	0	-1.520844
exp663	crash	0	0	crash	Scipy n=300 tol=1e-12 offset=0.9 — best scipy for pos	agent0	solver_param	1	0
exp664	crash	0	0	crash	Scipy n=300 tol=1e-12 offset=-0.9 — best scipy for neg	agent0	solver_param	0	0
exp665	0.00000000e+00	0.000000	0.000000	discard	Scipy n=300 tol=1e-12 offset=0.0 — best scipy for triv	agent0	solver_param	0	0.000000
exp666	8.81934684e-11	1.002503	1.000218	discard	Scipy n=200 tol=1e-10 offset=0.9 — scipy nontrivial	agent0	solver_param	0	-1.523848
exp667	8.81934685e-11	1.002503	-1.000218	discard	Scipy n=200 tol=1e-10 offset=-0.9 — scipy nontrivial	agent0	solver_param	0	-1.523848
exp668	9.11496370e-15	1.001296	-1.000019	discard	Fourier N=8 mode=2 offset=-1.0 amp=0.1 — exotic branch search	agent0	branch_search	0	-1.520844
exp669	5.19084746e-14	1.001296	-1.000019	discard	Fourier N=8 mode=2 offset=-1.0 amp=0.3 — exotic branch search	agent0	branch_search	0	-1.520844
exp670	2.80471109e-15	1.001296	-1.000019	discard	Fourier N=8 mode=2 offset=-1.0 amp=0.5 — exotic branch search	agent0	branch_search	1	-1.520844
exp671	1.73524424e-14	1.001296	1.000019	discard	Fourier N=8 mode=2 offset=-0.5 amp=0.1 — exotic branch search	agent0	branch_search	0	-1.520844
exp672	3.40342180e-13	1.001296	1.000019	discard	Fourier N=8 mode=2 offset=-0.5 amp=0.3 — exotic branch search	agent0	branch_search	0	-1.520844
exp673	1.87767940e-15	1.001296	1.000019	discard	Fourier N=8 mode=2 offset=-0.5 amp=0.5 — exotic branch search	agent0	branch_search	1	-1.520844
exp674	5.55111512e-17	1.001322	-1.000049	discard	Fourier N=1 negative u_offset=-0.9 newton_tol=1e-15	agent1	initial_cond	1	-1.520921
exp675	2.76924828e-21	0.000000	-0.000000	discard	Fourier N=8 mode=2 offset=0.0 amp=0.1 — exotic branch search	agent0	branch_search	0	-0.000000
exp676	4.28791901e-25	0.000000	-0.000000	discard	Fourier N=8 mode=2 offset=0.0 amp=0.3 — exotic branch search	agent0	branch_search	0	0.000000
