exp_id	residual	solution_norm	solution_mean	status	description	agent	design	elapsed_s	solution_energy
exp677	1.75047739e-17	0.000000	-0.000000	discard	Fourier N=8 mode=2 offset=0.0 amp=0.5 — exotic branch search	agent0	branch_search	1	-0.000000
exp678	2.29648796e-15	1.001296	-1.000019	discard	Fourier N=8 mode=2 offset=0.5 amp=0.1 — exotic branch search	agent0	branch_search	0	-1.520844
exp679	2.77764620e-15	1.001296	-1.000019	discard	Fourier N=8 mode=2 offset=0.5 amp=0.3 — exotic branch search	agent0	branch_search	0	-1.520844
exp680	6.33580461e-15	1.001296	-1.000019	discard	Fourier N=8 mode=2 offset=0.5 amp=0.5 — exotic branch search	agent0	branch_search	1	-1.520844
exp681	2.18831267e-13	1.001296	1.000019	discard	Fourier N=8 mode=2 offset=1.0 amp=0.1 — exotic branch search	agent0	branch_search	0	-1.520844
exp682	3.21852120e-15	1.001296	1.000019	discard	Fourier N=8 mode=2 offset=1.0 amp=0.3 — exotic branch search	agent0	branch_search	0	-1.520844
exp683	9.24647756e-15	1.001296	1.000019	discard	Fourier N=8 mode=2 offset=1.0 amp=0.5 — exotic branch search	agent0	branch_search	1	-1.520844
exp684	2.21224242e-13	1.001296	-1.000019	discard	Fourier N=8 mode=3 offset=-1.0 amp=0.1 — exotic branch search	agent0	branch_search	0	-1.520844
exp685	5.78273025e-15	1.001296	-1.000019	discard	Fourier N=8 mode=3 offset=-1.0 amp=0.3 — exotic branch search	agent0	branch_search	0	-1.520844
exp686	1.87087021e-15	1.001296	-1.000019	discard	Fourier N=8 mode=3 offset=-1.0 amp=0.5 — exotic branch search	agent0	branch_search	1	-1.520844
exp687	1.99540897e-15	1.001296	1.000019	discard	Fourier N=8 mode=3 offset=-0.5 amp=0.1 — exotic branch search	agent0	branch_search	0	-1.520844
exp688	9.01583919e-15	1.001296	1.000019	discard	Fourier N=8 mode=3 offset=-0.5 amp=0.3 — exotic branch search	agent0	branch_search	0	-1.520844
exp689	4.04187424e-14	1.001296	1.000019	discard	Fourier N=8 mode=3 offset=-0.5 amp=0.5 — exotic branch search	agent0	branch_search	1	-1.520844
exp690	2.17275952e-25	0.000000	-0.000000	discard	Fourier N=8 mode=3 offset=0.0 amp=0.1 — exotic branch search	agent0	branch_search	0	0.000000
exp691	1.81336727e-19	0.000000	-0.000000	discard	Fourier N=8 mode=3 offset=0.0 amp=0.3 — exotic branch search	agent0	branch_search	0	-0.000000
exp692	1.17676327e-14	0.000000	-0.000000	discard	Fourier N=8 mode=3 offset=0.0 amp=0.5 — exotic branch search	agent0	branch_search	1	-0.000000
exp693	1.94454731e-15	1.001296	-1.000019	discard	Fourier N=8 mode=3 offset=0.5 amp=0.1 — exotic branch search	agent0	branch_search	0	-1.520844
exp694	2.64652563e-13	1.001296	-1.000019	discard	Fourier N=8 mode=3 offset=0.5 amp=0.3 — exotic branch search	agent0	branch_search	0	-1.520844
exp695	1.94403919e-15	1.001296	-1.000019	discard	Fourier N=8 mode=3 offset=0.5 amp=0.5 — exotic branch search	agent0	branch_search	0	-1.520844
exp696	9.13375625e-14	1.001296	1.000019	discard	Fourier N=8 mode=3 offset=1.0 amp=0.1 — exotic branch search	agent0	branch_search	0	-1.520844
exp697	2.61597204e-15	1.001296	1.000019	discard	Fourier N=8 mode=3 offset=1.0 amp=0.3 — exotic branch search	agent0	branch_search	1	-1.520844
exp698	9.34318714e-15	1.001296	1.000019	discard	Fourier N=8 mode=3 offset=1.0 amp=0.5 — exotic branch search	agent0	branch_search	0	-1.520844
exp699	2.57581612e-16	1.001296	-1.000019	discard	Fourier N=4 negative u_offset=-0.9 newton_tol=1e-15	agent1	initial_cond	0	-1.520844
